compound,heading,neg,neu,pos
0.5789,On the train and saw this friendly face,0.0,0.651,0.349
0.0,Smol awoos,0.0,1.0,0.0
-0.296,My cat when he thinks there's no one home.,0.216,0.784,0.0
0.0,I work from home and my golden comes in my office everyday around noon to remind me that its time for a lunch break.,0.0,1.0,0.0
-0.296,Headed to a concert last night when something ran in front of my car. Needless to say I missed the concert and now have a new dog.,0.087,0.913,0.0
-0.2732,I was drunk in the French Quarter and a kind resident let me use their bathroom. I thought this cat was fake until it turned its head to watch me pee.,0.162,0.737,0.1
0.0387,When you want to go for a walk but it's raining,0.0,0.887,0.113
0.4939,We left Tater tot at home while we went to a festival over the weekend. Here’s the moment he realized we hadn’t left him forever,0.0,0.878,0.122
0.0,Caught this guy staring at our food from the balcony,0.0,1.0,0.0
0.0,Found this hat at petsmart and had to buy it for her 😂,0.0,1.0,0.0
0.0,"""You're home! Rub my belly!""",0.0,1.0,0.0
0.7783,Cutest engagement announcement.,0.0,0.128,0.872
0.0,Look at me! I'm a snowman,0.0,1.0,0.0
0.0,Shelter dog finds out he’s been adopted,0.0,1.0,0.0
0.4939,"Update: I moved ~3 months ago, I returned to the window today to visit an old friend.",0.0,0.814,0.186
0.1779,"Went to adopt a cat, I think we were chosen instead",0.0,0.825,0.175
0.3365,"I said no three times at the SPCA because I’m not a cat person. She sat and purred in my lap as the lady said “How? She won’t let anyone hold her!”. I knew I wanted her then. Three days later my girlfriend said “she got adopted today”. When I asked by who, she said “us!”. Welcome home Nirvana.",0.038,0.9,0.062
0.0,zen birb,0.0,1.0,0.0
0.0,"""Do it again, do it again!""",0.0,1.0,0.0
-0.5106,Dog steals owner's GoPro and subsequently the show,0.32,0.68,0.0
-0.5423,"Otter finishes playing dead, then he realizes the person is still looking",0.267,0.621,0.112
-0.34,Chicago fire department saves a kitty,0.375,0.625,0.0
-0.296,No one needs a tusk except an elephant,0.268,0.732,0.0
0.0,He didn't even flinch when I grabbed the camera...,0.0,1.0,0.0
0.0,Very smol awoo,0.0,1.0,0.0
0.0,"The vet sent us this, this morning 😭. I can't wait to pick up our kid tomorrow!",0.0,1.0,0.0
0.818,My friends bunny is so adorable!,0.0,0.348,0.652
0.0,Lil Mav at work with me!😻,0.0,1.0,0.0
0.0,My daughter looks like a mom that regrets all her life decisions.,0.179,0.643,0.179
0.3612,Meet Cinnamon. She was born with ears that look like cinnamon rolls.,0.0,0.815,0.185
0.6369,This guy found the best in the park place to rest,0.0,0.704,0.296
0.4939,My friend works for animal control and met this little behemoth.,0.0,0.758,0.242
-0.5255,When hippos attack!,0.629,0.371,0.0
0.1511,I want fish!,0.0,0.386,0.614
-0.5106,Dogs waiting to enter the hospital rooms of sick children for animal therapy.,0.216,0.784,0.0
0.0,"Tried Craigslist for the first time, and now my heart is full.",0.0,1.0,0.0
0.0,Father/Daughter Halloween Costume,0.0,1.0,0.0
0.0,Little girl finds out she has been adopted,0.0,1.0,0.0
0.3612,Out like a light (wait for the end),0.0,0.706,0.294
0.0,I am Groot.,0.0,1.0,0.0
0.0,I just can’t get enough of this,0.0,1.0,0.0
-0.296,Watched my coworkers dog for an afternoon and now he won’t stop staring at me,0.136,0.864,0.0
0.6369,Turkey got the best of them,0.0,0.543,0.457
0.0,"""I'll handle this, human.""",0.0,1.0,0.0
0.0,Dad started putting in new toilet. Walked away for a few minutes and came back to this.,0.0,1.0,0.0
0.0,This turtle is fast,0.0,1.0,0.0
0.4767,"""Every Tuesday this little boy waits with snacks for his friends""",0.0,0.763,0.237
0.0,Man ambushed by cheetah,0.0,1.0,0.0
0.0,Kitty makes eye contact with dog and falls,0.0,1.0,0.0
0.3818,Guinea pigs on their way to protect the princess.,0.0,0.755,0.245
0.4019,My SO's dad is in Mexico on holiday and just sent us this,0.0,0.816,0.184
0.7964,When childhood friendship turns into love.,0.0,0.36,0.64
0.4939,Our boxer made a new friend today.,0.0,0.61,0.39
0.891,My daughter’s hair is fabulous and I love when she lets me brush it without fussing. One of my favorite daddy daughter times.,0.0,0.642,0.358
0.0,He wears his heart on his head ❤️,0.0,1.0,0.0
-0.357,Building asparagus walls won't stop freedom.,0.364,0.432,0.204
0.7351,Get yourself a dog that loves you like this.,0.0,0.492,0.508
0.3716,"I eat lunch outside everyday with my dog. Work isn’t always great, but this 30 minutes is something I always look forward to.",0.0,0.887,0.113
0.0,My painting of Corgi butts!! Such floof!,0.0,1.0,0.0
0.5228,Went to the shelter last night. Came back with this good boy.,0.0,0.765,0.235
0.0,"My college roommate dropped by while he was in town, I think my pupper remembered her old roomie",0.0,1.0,0.0
0.1027,A cat rescued from the Camp fire in California,0.214,0.536,0.25
-0.2732,Nervous cadet on the first day,0.296,0.704,0.0
0.3506,"A redditor who I will not name bought me pizza and wings after my losing my job post. I don't deserve this, but thank you, I will remember you, L.",0.062,0.826,0.112
0.0,Hey i can do that too.,0.0,1.0,0.0
-0.3182,My golden found her rubber pacifier she'd lost as a puppy.,0.204,0.796,0.0
0.8402,"I trained my Great Dane to take selfies with me - if I'm sitting and extend my arm with my phone in hand, she plops up next to me, leans, and gives the camera this look 😊",0.0,0.775,0.225
0.6369,The happiest boye,0.0,0.323,0.677
0.0,When they all wake up from their nap at once...,0.0,1.0,0.0
0.4767,He seems proud of himself.,0.0,0.563,0.437
0.5106,My heart just can't handle this level of cuteness,0.0,0.708,0.292
0.0,When you're the always the cold one in the relationship.,0.0,1.0,0.0
0.8625,"My 16-year old bro lives with my 75-year old parents. He’s a great kid who does t complain. I took him to get a haircut at an actual barber, we bought new clothes that weren’t from Walmart. His confidence skyrocketed in a day. I caught him “fixing” his hair after the day. Made me happy.",0.043,0.768,0.189
0.69,This is Lily. She’s 21. She doesn’t see or hear too well but she smells good enough to wake up and run to the kitchen when she smells chicken!,0.0,0.826,0.174
-0.4588,My blind dog was waiting for mom at the wrong door. Bless his heart.,0.296,0.561,0.143
0.5256,My kitten keeps bringing us leaves she caught in the garden as presents. Today she was especially proud of this Very Big One.,0.0,0.866,0.134
0.0,Foreground...background,0.0,1.0,0.0
0.3542,"Every year I fall victim to SAD (Seasonal Affective Disorder). This year I started taking my neighbors dog for walks, and his joy for life has kept me positive through the long winter.",0.147,0.669,0.183
0.3595,"Office kittens, Debit and Credit, were working hard today!",0.124,0.62,0.256
0.8979,Sometimes I catch her just staring and smiling at me. She’s my precious love.,0.0,0.478,0.522
0.7003,Good girl came to check on me after I dropped something really loudly in the middle of the night...and brought me gift just in case,0.0,0.791,0.209
-0.4449,A Victorian couple trying not to laugh while having their portraits done.,0.226,0.774,0.0
-0.4767,My daughter has been begging us for a kitten for months. We’ve told her in no uncertain terms we are NOT getting a kitten. This is what awaits her on Christmas morning..,0.135,0.826,0.04
0.8442,"Growing up with your best friend, the brick.",0.0,0.355,0.645
0.0,"I've been waiting my whole life for this moment, Reddit, meet my new baby Hubble!",0.0,1.0,0.0
-0.0516,She texted me “he won’t leave me alone”,0.146,0.854,0.0
0.0,"I’m 30 yrs old and I got my very first kitten, meet Mango!",0.0,1.0,0.0
-0.5411,"Fear not, small human! Here is your balloon.",0.333,0.667,0.0
0.0,My dog every time my dad gets home from work,0.0,1.0,0.0
0.0,Do you think we need a DNA test?,0.0,1.0,0.0
-0.2263,Mr. Steal yo girl fresh back from the groomer,0.256,0.56,0.184
-0.1027,You can swim hard or you can swim smart...,0.149,0.851,0.0
0.5093,Loki's 1st birthday is today. He's still carrying around his favorite toy!,0.0,0.77,0.23
0.0,I got to snuggle with a capybara,0.0,1.0,0.0
0.0,Basically a renaissance painting,0.0,1.0,0.0
0.0,Just met at the vet,0.0,1.0,0.0
0.0,My dog heard me throwing up and came to check on me,0.0,1.0,0.0
0.0258,All aboard the Catbus,0.0,0.732,0.268
0.5106,"Once your run into a window, you have trust issues.",0.0,0.708,0.292
0.0,I always come home after work at 5.30pm. My husband sent a photo of her face at 6pm when I didn’t come home because I’m interstate for a conference. 4 more days of heartache...,0.0,1.0,0.0
-0.4404,Even dogs know the universal law forbidding movement if there's a cat in your lap,0.182,0.818,0.0
0.0,It wasn’t me it was him,0.0,1.0,0.0
0.0,"Stella, 8 weeks, 10/10 would pet again.",0.0,1.0,0.0
0.4588,When a Black Leopard sees his favorite zookeeper,0.0,0.667,0.333
-0.4272,Ever been licked so hard it drags you across the ground?,0.299,0.701,0.0
0.3818,The face of innocence,0.0,0.536,0.464
0.0,Teamwork makes the dreamwork,0.0,1.0,0.0
0.4939,"Meet Bridget, she is 13 and adorable.",0.0,0.652,0.348
0.5859,Too much beauty in one picture,0.0,0.568,0.432
0.8555,My moms rescue dog Rico is best friends with my baby. I interrupted them watching Peppa Pig.,0.089,0.484,0.427
0.6369,Love his concentration,0.0,0.323,0.677
0.6114,Thank You 😍For those of you who have disabled children know the feel when people look but aren’t sure how to interact with your kiddo. Winnie the Pooh melted my heart and knew exactly what to do!,0.0,0.875,0.125
0.8011,"To quote my friend ""I couldn't tell who was happier to see who!"" Dad is back home!",0.0,0.676,0.324
0.0,two baby weasels pose for a photograph,0.0,1.0,0.0
0.8074,This is not my cat. I do not know this cat. But a friend shared this pic on FB and I had to give it a signal boost.,0.0,0.717,0.283
0.0,Handing out snax,0.0,1.0,0.0
0.0,"When you said ""slay"" instead of ""stay""",0.0,1.0,0.0
0.0,Get the ball girl.,0.0,1.0,0.0
0.6249,That owner is awesome,0.0,0.423,0.577
0.09,"My puppy is growing old, but she will always be the goodest girl.",0.0,0.899,0.101
0.4215,Efficient and Appealing,0.0,0.417,0.583
0.0,"Behold, a rare Oreo cloud!",0.0,1.0,0.0
0.7249,best. day. of. his. life!!!,0.0,0.441,0.559
0.0,Yahtzee!!!,0.0,1.0,0.0
0.6249,Husky good boy helping mum look after a new born,0.0,0.579,0.421
0.0,My nephew found a sea shell with squid eggs inside.,0.0,1.0,0.0
0.0,I is wind,0.0,1.0,0.0
0.5719,This is Rudy. Rudy loves me. Ruby is not my cat.,0.0,0.73,0.27
-0.4404,"His first ever bath - a bit scared at first, he quickly got used to it",0.182,0.818,0.0
0.6588,8 week old Great Dane. Those paws!,0.0,0.532,0.468
0.0,A bit overprotective,0.0,1.0,0.0
-0.4887,"Please keep this idiot in your thoughts and prayers. He's not sick, just very, very dumb.",0.297,0.496,0.207
0.0,Everyone seems to be pulling this now!,0.0,1.0,0.0
0.25,Just found out our kitty plays fetch,0.0,0.75,0.25
0.0,He never leaves my side as soon as I’m home from my treatments!,0.0,1.0,0.0
0.4588,"My Grandparents just put up a photo of three generations, all cute.",0.0,0.769,0.231
0.4939,This pretty girl turns 15 today so we took her to the beach.,0.0,0.789,0.211
0.0,Old man remembering jazz,0.0,1.0,0.0
0.0,Girl moved abroad 9 months ago and wanted to know if her dog would recognize her on a videocall. She did!,0.0,1.0,0.0
0.4588,"Felt cute, might delete later tho",0.0,0.625,0.375
-0.5106,Good boi attacks water snake damaging a Jeep,0.473,0.305,0.221
0.0,She didn't grow into them,0.0,1.0,0.0
0.0,This Cat for the first time realized she has ears. 😸👍,0.0,1.0,0.0
0.2263,Blind puppy happily chasing after his human's voice.,0.22,0.488,0.293
0.636,Magnificent! Isn't it?,0.0,0.323,0.677
0.0,"Guy signs ""walkies"" to his deaf dog",0.0,1.0,0.0
-0.4404,Husky telling hooman he's scared of the water,0.293,0.707,0.0
0.5983,Navy Seals got a much needed laugh when an actual Seal decided they wanted to train with them!,0.0,0.804,0.196
0.4215,A teacher likes her makes a MASSIVE difference.,0.0,0.641,0.359
0.0,Bride and Groom ask their grandmothers to be their flower girls.,0.0,1.0,0.0
0.0,Me and my girlfriend moved in together yesterday and brought our cats. Walked in and this was them. We thought they wouldn’t get along.,0.0,1.0,0.0
0.0,Sup?...ₚₒₒₚ,0.0,1.0,0.0
-0.5719,"""I hate everyone...except you.""",0.552,0.448,0.0
0.0,Boop,0.0,1.0,0.0
0.3612,"He looks like both, lion and a cat",0.0,0.706,0.294
0.6486,She likes to be held like this every day when I get home from work,0.0,0.694,0.306
0.25,My cat plays fetch.,0.0,0.6,0.4
0.5423,This cat wishes you a good night,0.0,0.471,0.529
0.7003,I took that cute cat everyone likes and photoshopped him to where he belongs,0.0,0.655,0.345
0.0,"Oh, hello. I didn't see you there.",0.0,1.0,0.0
0.0,This is Robert. He does this every time he realizes his walk is over.,0.0,1.0,0.0
0.3612,This looks like a very sound sleep,0.0,0.667,0.333
0.0,"My girl tried an experiment to see if the snails that would come up to her at night were always the same ones or not. So she accessorized one, and guess who showed up the next night?!",0.0,1.0,0.0
0.0516,A Lioness And Her Carer Playing Before Falling Asleep Together,0.154,0.673,0.173
0.0,Picture of the UPS guy from his point of view,0.0,1.0,0.0
0.765,Great Dane doing lunges like his owner,0.0,0.431,0.569
0.3818,Big brother helps his sister do her hair,0.0,0.729,0.271
0.4767,Forever friends,0.0,0.244,0.756
0.4588,Guess it wanted the warmth as well...,0.0,0.667,0.333
0.8126,Your best friend will always have your back.,0.0,0.448,0.552
0.0772,Uppercase cat and lowercase cat,0.0,0.755,0.245
0.0,My dog and my cat are the same size. This is them on a daily basis.,0.0,1.0,0.0
0.4939,Cat introduces its kittens to an old friend,0.0,0.686,0.314
0.0,When he realizes I'm looking at him,0.0,1.0,0.0
0.0,Wonder what this does..,0.0,1.0,0.0
0.2235,"Human, you mustn't stop",0.0,0.614,0.386
0.296,the real purpose of coffee cup handles: birb warmer,0.0,0.784,0.216
0.5095,Bunnies only flop over like that when they feel completely safe,0.149,0.497,0.354
0.0,"My roommate signed us up to “foster” pit bulls, 2 days later the foster home turned into forever home. Say hi to Prince",0.0,1.0,0.0
0.0,Role model,0.0,1.0,0.0
0.0,Bandit turned 25 years old on December 7th!,0.0,1.0,0.0
0.0,He knows he's the goodest boy,0.0,1.0,0.0
0.0,Met a hefty 225 pounder malamute yesterday! Giant is an understatement,0.0,1.0,0.0
0.4939,The dog that changed my life two years ago. We had a relaxing day on the coast today.,0.0,0.833,0.167
0.4215,This is Basil 🌿. She likes my shoulder,0.0,0.714,0.286
0.4767,Dog becomes friends with a river otter while out on a walk,0.0,0.744,0.256
0.75,Dog loves her wheelchair because it means she gets to play outside!,0.0,0.61,0.39
0.6275,Curious little cat fascinated by pottery,0.0,0.439,0.561
0.5994,"Every step you take, I’ll be loving you.",0.0,0.642,0.358
0.0772,I see all of your baby animals and raise you this baby screwdriver leaving the nest for the first time.,0.0,0.933,0.067
-0.6705,This cat has no problem falling asleep in his little bed,0.448,0.552,0.0
0.0,Two wiggly pitties the vet clinic yesterday,0.0,1.0,0.0
0.6705,"The last surviving rescue dog from 9/11, sitting at Ground Zero",0.0,0.621,0.379
0.0,Maybe she's barn with it. Maybe it's Neighbelline.,0.0,1.0,0.0
0.7506,"Ive been allergic my whole life to cats. Ive finally built up enough of an immunity through injections. Reddit, please welcome my first rescue kitty, Legolas.",0.067,0.671,0.262
0.0,Wearing glasses for his first time,0.0,1.0,0.0
-0.5449,i touch da fis... NO YOU DON'T!!,0.413,0.587,0.0
0.0,My dog is acting kinda wierd,0.0,1.0,0.0
0.0,Kitten petting smaller kitten.,0.0,1.0,0.0
0.6239,The cutest!,0.0,0.196,0.804
-0.4019,When you have evil plans but it’s bath time,0.252,0.748,0.0
