compound,heading,neg,neu,pos
0.0,Heat index was 110 degrees so we offered him a cold drink. He went for a full body soak instead,0.0,1.0,0.0
0.6249,"Kirk, a female Border Collie, watching herself win the 2017 Purina Pro Challenge.",0.0,0.662,0.338
0.2235,Nothing will stop this dog from protecting his owner,0.0,0.809,0.191
0.4532,My 90yo neighbor hasn’t walked her dog in years so I volunteered to do it for her. So proud of Buddy’s weight loss!!!,0.087,0.753,0.161
0.4588,His favorite spot when traveling.,0.0,0.571,0.429
0.2023,Removed the top of my desk for cleaning. Cat did not understand,0.0,0.859,0.141
0.5473,My daughter's reaction when holding her new baby sister. Much heavier than the dolls she practiced on. LOL,0.0,0.828,0.172
0.7506,A regular customer's heartwarming reaction to a free cake on her birthday,0.0,0.556,0.444
0.4404,Good boy got the photo 10/10,0.0,0.633,0.367
0.8442,My son has loved my cat since the day he was born. She tolerates that love in a way I never thought possible.,0.0,0.701,0.299
0.5106,This is Ben. He has a beard. And he is human sized. We get fun looks in traffic.,0.0,0.829,0.171
0.25,My sister’s blind dog loves fetch,0.26,0.385,0.356
0.4588,When you get to bring your dog to work and she reminds you that you’re her favorite person.,0.0,0.85,0.15
-0.2732,Nervous cadet reporting for duty.,0.344,0.656,0.0
0.0,My landlord was replacing our sink and sent me this.,0.0,1.0,0.0
0.5719,Kids sing Happy Birthday with sign language for their deaf custodian,0.0,0.73,0.27
0.0,This is how they sleep every night.,0.0,1.0,0.0
-0.1779,"Our cat is obsessed with blanket forts, so we made him this. He has wares, if you have coin.",0.086,0.914,0.0
0.9287,"Moose. My sidekick, my partner, my best friend. Thank you for being such an amazing creature.",0.0,0.467,0.533
0.0,One dog has ear medicine she needs and the other one also thinks he needs it too,0.0,1.0,0.0
0.6115,Smooches from his fren makes him very happy,0.0,0.637,0.363
0.0,My cat realizing I am watching him do what I have repeatedly told him not to do,0.0,1.0,0.0
0.0,Eating breakfast at a small cafe when this little guy hopped on the table,0.0,1.0,0.0
-0.6468,"Mittens! I told you, no more fighting.",0.569,0.431,0.0
0.8074,Proud boy finding best stick,0.0,0.291,0.709
0.5859,I take it my mailman is a dog lover.,0.0,0.612,0.388
-0.4404,"My autistic son hates his photo taken, so I let him wear a t-rex suit for family photos.",0.162,0.838,0.0
0.7783,"I haven’t met my new neighbor yet, but her dogs love me",0.0,0.633,0.367
0.0,"Not many farm cats make it to 18, but Carrot has",0.0,1.0,0.0
0.5719,Loves getting his haircut.,0.0,0.448,0.552
0.4753,I take my dog to my store every day. One older Italian woman liked Bentley so much she came back and gave him a hat she knitted!,0.0,0.886,0.114
0.0,Power Up.,0.0,1.0,0.0
0.0,When you just can’t believe that you’re seeing TWO of Mommy.,0.0,1.0,0.0
0.0,Waiting for food,0.0,1.0,0.0
0.7546,"My cat Pepe loved my roomie, and she recently moved out. I’m not crying, you’re crying...",0.0,0.684,0.316
0.6956,Woke up to this gorgeous one above my front door.,0.0,0.655,0.345
0.0,My daughter does this every time she wakes up and sees me,0.0,1.0,0.0
0.0,Finally found where he’s been disappearing to 🐶,0.0,1.0,0.0
-0.0516,"Every day I point the camera at the couch when I leave for work, so I can capture their snuggles.",0.07,0.93,0.0
0.0772,My Dad (79) went from “I don’t want that dang cat” to carrying her to “her room” for bed each night.,0.0,0.939,0.061
0.0,Adopting a Kitten,0.0,1.0,0.0
0.0,I will not let go,0.0,1.0,0.0
0.4767,Sushi’s proud moment,0.0,0.392,0.608
0.0,Today is my 18th birthday everyone.,0.0,1.0,0.0
0.6124,My college is finally giving our tireless pizza chef the credit he deserves,0.0,0.688,0.312
0.296,The boss said it's ok to bring your cat to work today.,0.0,0.833,0.167
0.0,10 years ago and now,0.0,1.0,0.0
0.5302,"Big brother gets a tattoo of little brother on arm, little bro loves it",0.0,0.778,0.222
0.3612,Moose looks like he belongs on a wanted poster,0.0,0.737,0.263
0.0,"I’ve spent the last several months telling him NOT to lick the baby’s face, but it turns out that’s all she really wants.",0.0,1.0,0.0
0.3182,Will you please do that one petting thing on my head?,0.0,0.813,0.187
0.2263,Mister Rogers gets surprised by a boy who had appeared on his show,0.0,0.853,0.147
-0.1531,I think someone has a crush on my Christmas light decoration,0.167,0.833,0.0
0.4753,Two brothers were rescued and treated at different NGOs. The reaction when they are reunited is priceless!,0.0,0.838,0.162
0.1027,A Puppy Saved From A Fire Becomes A Firefighter,0.261,0.435,0.304
0.2144,When you’re at a party but you find the dog,0.0,0.812,0.188
0.7717,"Elliot's owner shares what he looked like at 4 weeks vs full grown, with his favorite toy",0.0,0.628,0.372
0.0,"Covering a story at an animal shelter, a journalist was grabbed by this dog and wouldn't let go. The journalist eventually adopted him!",0.0,1.0,0.0
0.0,"I'm a beekeeper, and this is our Christmas card this year!",0.0,1.0,0.0
0.9413,Best friend gets a new best friend,0.0,0.119,0.881
0.7073,My husband-to-be and my doggo have this great thing going on.,0.0,0.672,0.328
0.5106,"""I'm Free""",0.0,0.233,0.767
0.9097,"I don't know how this sub likes mice, but here is my oldest and most favorite mouse, Merry.",0.0,0.549,0.451
0.0,Pet the kitty,0.0,1.0,0.0
0.0,Hig will sit on my steps and howl until I open the door and acknowledge him. Also Hig is not my dog.,0.0,1.0,0.0
0.0387,When you want a Golden Retriever but are only allowed to get a cat,0.0,0.905,0.095
0.0,Puppy I found in the oilfields of West Texas. Named him Dobby,0.0,1.0,0.0
0.0,The smallest awooo,0.0,1.0,0.0
0.0,His first time to the vet,0.0,1.0,0.0
0.8832,"I volunteer for a dog rescue, we love seeing updates of the dogs in their new homes. This one made me smile!",0.0,0.623,0.377
0.8591,"My wife looves giraffes, so when we first started dating, I took her to her first close up experience with one. This is still one of my favorite photos of her - it was pure bliss, followed by buckets of happy tears.",0.039,0.745,0.215
-0.3182,Instant Trap,0.697,0.303,0.0
-0.4389,"Ah, You Got Me!.. Is He Still Lookin?- Oh Crap.",0.243,0.757,0.0
0.0,Lessons were learned that day,0.0,1.0,0.0
0.0,"The homeowner said that the buck shows up everyday, so they gave him a bed too.",0.0,1.0,0.0
0.0258,He thinks we're playing hide and seek.,0.2,0.588,0.212
0.0,"I'm not allowed a dog, so my neighbors built a window into my yard so I can pet theirs!",0.0,1.0,0.0
0.0,Peter Dinklage and his daughter,0.0,1.0,0.0
0.4019,I decided to go back to college in my 30's and my grandma sends me a card every month for support.,0.0,0.87,0.13
0.8034,This is our daughter... She is 4 and has cerebral palsy. Her birthday was today and got this cool toy. It took her literally about 5 minutes to scoot to it and climb up like this. She has never done this before. Just a personal aww that I'm proud of.,0.0,0.843,0.157
0.0,Look what I caught my contractor doing!!!,0.0,1.0,0.0
0.0,22 years and counting.,0.0,1.0,0.0
0.7269,"Last year, while setting up lights for some glamour shots, Kodiak decided he would sit to help me test.",0.0,0.736,0.264
0.5574,Business professor brought in his dog to class to help calm nerves before the big exam.,0.072,0.67,0.258
0.3612,"This is my new dog, Blu. His tongue sticks out like this all the time.",0.0,0.848,0.152
0.5719,"When you partied too hard last night, now you gotta clean up the litter the next morning",0.068,0.683,0.249
0.6705,We built a catio so our indoor cats could enjoy fresh air and nature. The dogs are jealous...,0.0,0.732,0.268
-0.0951,This isn't a joke. Seriously - buy me...,0.255,0.54,0.205
0.5972,Hello Wisconsin!! Maverick has enjoyed your cheese and is now basking in your sun ☀️,0.0,0.783,0.217
0.0,My dad has just figured out how to use the front camera. This is the first picture he sent.,0.0,1.0,0.0
0.0,Vacuuming at an animal shelter.,0.0,1.0,0.0
0.0,my girlfriend’s tattoo of her cat in a shark costume and her actual cat in a shark costume,0.0,1.0,0.0
0.4981,"Wait for me! OK, now you can.",0.0,0.65,0.35
0.128,Are you feeling blue?,0.0,0.667,0.333
-0.7644,My dog finally defeated the resident bully tonight!,0.524,0.476,0.0
0.4019,This child after being freed from ISIS by Iraqi soldiers.,0.0,0.769,0.231
0.0,"Left dog with interns at work, came back to this",0.0,1.0,0.0
0.6124,"The first time I visited my girlfiend (now wife) in college I bought a peach tree from a local nursery and told her, ""someday we will eat peaches from it years from now, because we will still be together."" Well it worked better than I planned. Here is our son eating a peach from that very tree.",0.0,0.907,0.093
0.6705,This is what cat engagement photos would look like.,0.0,0.56,0.44
0.0,"My boyfriend and I got a puppy two weeks ago. Today I left him for the first time to start college classes, and my boyfriend sent me this.",0.0,1.0,0.0
0.5707,3 years in and I've finally got a photo that does her justice!,0.0,0.73,0.27
0.4939,This adorable proposal.,0.0,0.385,0.615
0.4588,"A sweet, older gentleman",0.0,0.4,0.6
-0.296,"I was away at a conference for two days, I think I may have been missed",0.167,0.833,0.0
0.0,The Only Medicine I Need,0.0,1.0,0.0
0.0,"First photo of us, six years later",0.0,1.0,0.0
0.2023,German shepherd with Golden retriever mix. Cuteness overload 😄,0.212,0.508,0.28
0.0,He was purring the entire ride home.,0.0,1.0,0.0
0.836,"My daughter has a huge heart for dogs and begged for months to get another rescue. She even used all her money to pitch in for the fees. Here she is with our third rescue pupper, Daisy.",0.0,0.788,0.212
0.0,"This duck used to come to my porch for food. Recently, she brought her babies. I've been watching them grow up.",0.0,1.0,0.0
0.0,That dog got shooketh.,0.0,1.0,0.0
-0.5994,"Two cats won't give up on trying to enter a Japanese Art Museum, the war has been going on for 2 years now.",0.163,0.837,0.0
0.1027,My husband is a school caretaker and has to let these chunky boys out every morning. (I apologize on his behalf for the vertical video.),0.0,0.943,0.057
0.3612,The smile that can melt steel,0.0,0.667,0.333
-0.5256,Dog bumped into me while I was carrying my cereal bowl. He was very sad about it.,0.184,0.816,0.0
0.5106,Took my rescue greyhound to get her photo taken. Nailed it.,0.0,0.752,0.248
0.0,Moist owlette,0.0,1.0,0.0
0.4926,Good Morning from Utah!,0.0,0.484,0.516
0.4215,I rescued the cat off the street. Photos before and after. One month difference. Part 2.,0.0,0.833,0.167
0.0,This grandpa's reaction to seeing his granddaughter,0.0,1.0,0.0
0.0,Marmalade is becoming an expert at jumping into his pouch,0.0,1.0,0.0
0.0,can we get another ball??,0.0,1.0,0.0
0.8934,A cute amazon review I revisit just for a smile. An 88 year old woman and her 92 year old husband attend a Halloween party. Btw they liked the bee costume.,0.0,0.634,0.366
0.4588,My puppy and my baby girl fight over who's going to warm their butt on the vent in the morning. The baby won today. The puppy is pouting about it.😂,0.074,0.767,0.159
0.2732,Solved: why my pants always have a line of cat fur across the leg.,0.0,0.851,0.149
0.0,This is the life we should all aspire to.,0.0,1.0,0.0
0.6369,"Abbey, The Dog From 'I Am Legend', Is Now 13 And Living Her Best Life",0.0,0.769,0.231
0.0,my boyfriend managed to sneak our floofer through a 30 minute trail behind the stadium so she could be at my graduation,0.0,1.0,0.0
0.0,Got this little guy yesterday,0.0,1.0,0.0
-0.1739,Bummer wants to thank everyone who upvoted his puppy vaccination video today!!,0.203,0.638,0.159
0.0,"My baby Huxley is going into surgery right now, the vet techs sent me this.",0.0,1.0,0.0
-0.2398,"My kitten bringing his new toy to his older, incredibly fearful and shy older brother to check out. Probably the cutest thing I’ve ever recorded.",0.182,0.697,0.12
0.0,My boss brought her Labrador into the office today. He came and said hello.,0.0,1.0,0.0
0.4574,My chicken just hatched out three healthy chicks! 🐣,0.0,0.701,0.299
0.0,Let’s spend all nine lives together.,0.0,1.0,0.0
0.3612,Look at this asshole using up two seats like he owns the train or something,0.0,0.848,0.152
0.0,Chicken completes tiny agility course (Wait for the hop),0.0,1.0,0.0
0.4939,A tiger checking the depth of the water before relaxing,0.0,0.714,0.286
0.3182,Peach wants to know who is responsible for this sign.,0.0,0.796,0.204
0.0,Weekend plans right here,0.0,1.0,0.0
0.0,"My Dad is afraid to fly, so when I was 5 yrs old I made him a doll to hold on the plane. Mom just sent me this picture. He is packed to come visit me. The doll is 43 years old!",0.0,1.0,0.0
0.4404,How to impress a Disney Princess.,0.0,0.58,0.42
0.0,This 3 sec video touches my heart,0.0,1.0,0.0
0.0,I have the REAL Scooby Doo,0.0,1.0,0.0
0.0,Overprotective mama cat,0.0,1.0,0.0
0.0,Diabolical kitty about to take over the world!,0.0,1.0,0.0
0.4588,Her new favorite game,0.0,0.5,0.5
0.0,My 1.5yr old son and 14yr old cat had a moment this morning.,0.0,1.0,0.0
-0.2023,My sisters dog is strange,0.31,0.69,0.0
0.0,Whatcha lookin at human?,0.0,1.0,0.0
-0.296,"Was worried about bringing my new pupper home to my cat. I was right, it’s a massacre",0.136,0.864,0.0
0.0,"Here, lemme fix it for you",0.0,1.0,0.0
0.6249,"He hates every cat brush we bought him, but he loves my dad's yard broom 😸",0.098,0.65,0.253
0.0,Toddler shows his buddy that a sprinkler is nothing to be afraid of,0.0,1.0,0.0
0.1779,Office dog wants to play fetch but everyone is too busy working.,0.0,0.866,0.134
0.0,Seems legit,0.0,1.0,0.0
0.0,Dad cat brings baby separated from mom back to her...,0.0,1.0,0.0
0.0,We got a new puppy yesterday. I asked my 4 year old to put him to bed. This is what I came back to,0.0,1.0,0.0
0.0,He rolled around in sidewalk chalk,0.0,1.0,0.0
0.0,Little dudes first time experiencing snow!,0.0,1.0,0.0
-0.0772,"Someone that had the wrong number just sent me this picture, but it's too good to ignore",0.227,0.558,0.215
0.0,I don't think I'll need a paternity test,0.0,1.0,0.0
0.0,Looks legit,0.0,1.0,0.0
0.5902,"This little guy has no nose and is missing an ear, but is the friendliest neighbourhood cat ever. I call him Voldemort.",0.118,0.693,0.189
0.0,Heres a Dog realizing you can stand in a pool,0.0,1.0,0.0
0.6466,Mulder found the biggest Pine cone he's ever seen! He was so proud of himself as he pulled it out a bush to show me.,0.0,0.843,0.157
0.0,This regal unit,0.0,1.0,0.0
0.7506,This old man turned 15 today. Can we wish my four legged baby a happy birthday?,0.0,0.67,0.33
0.0,Spooky level is rising,0.0,1.0,0.0
0.0,The ratio of dog to boy stayed constant,0.0,1.0,0.0
0.0,"Whenever Ingo has a stick, Poldi is flying there",0.0,1.0,0.0
0.0,Sunbathing Through South Carolina ☀️,0.0,1.0,0.0
-0.631,"I’m getting married today. I woke up early and practiced my vows on my cat, but he didn’t even cry once. Should I rewrite the vows or get a more sensitive cat?",0.129,0.871,0.0
0.4019,I shouted at my kitty today for being naughty. 5 mins later I find my other kitty comforting her and glaring at me.,0.0,0.876,0.124
-0.1027,"According to his owner, ""He constantly thinks the screen door is closed, so we have to pretend to open it for him to come inside.""",0.055,0.945,0.0
0.6696,The love for broccoli is UNREAL!,0.0,0.527,0.473
0.0,Herbie,0.0,1.0,0.0
0.6369,"Caught this scrub hanging out the passenger side of his best friend's ride, Trying to holler at me.",0.0,0.802,0.198
-0.1175,"Adopt, don’t shop! Was so hard not to let go..",0.182,0.675,0.143
0.0,⚠️BIG SNEEZE INCOMING⚠️,0.0,1.0,0.0
0.0,"I've waited 28 years to finally havr my first pet. Everyone, meet Mycroft.",0.0,1.0,0.0
0.0,Sleepy boye,0.0,1.0,0.0
0.0,Found this guy under my car this morning. Spent about 10 minutes hand-feeding him carrots and broccoli,0.0,1.0,0.0
0.6369,"Best buds, then and now.",0.0,0.488,0.512
0.0,It’s my girl’s 15th birthday!,0.0,1.0,0.0
0.0,Baby otter exploring water for the first time,0.0,1.0,0.0
0.0,"A lion recognizes his dad, the Lion Whisperer",0.0,1.0,0.0
0.6697,"I just got my boy from the pound, where he has spent the last two months. This was his incredibly happy reaction to feeling a bed.",0.0,0.8,0.2
0.6486,We rescued Dixie a little over a month ago. That smile says it all.,0.0,0.654,0.346
0.296,This horse helping the girl get on,0.0,0.732,0.268
0.0,My cat ... dont even know what to say 😅🤦🏼‍♂️,0.0,1.0,0.0
-0.4215,If she goes outside we shut the door and she hates it. So she keeps her butt inside to prevent this while she birdwatches. Meet Sofie.,0.104,0.857,0.039
0.0,‘Am I a mama now?’,0.0,1.0,0.0
0.5399,Looking good for 23!!,0.0,0.463,0.537
0.0,I put a note in my son’s lunch everyday. Today at parent/teacher conferences I found out that he keeps every one.,0.0,1.0,0.0
-0.2755,"When you say ""wake up"" to them they wiggle their ears to let you know they aren't ready to get up yet",0.091,0.909,0.0
0.0,Joe Biden and his newly adopted little buddy.,0.0,1.0,0.0
-0.4215,"I was having a bad day and this dog walked to my bus stop, sat on the bench and asked me for pets. I'm now having a good day.",0.18,0.728,0.092
0.2732,my 11 y/o sister receiving her surprise Christmas present,0.0,0.792,0.208
0.0,"Benjen was mean to the vet, so they suggested we get him used to being swaddled. Now he's a purrito.",0.0,1.0,0.0
0.0,I started fostering kittens about a month ago. This is my life now.,0.0,1.0,0.0
0.4588,Therapy dogs waiting to welcome the Parkland kids back to school for the first time today,0.0,0.833,0.167
0.0,This is Jim,0.0,1.0,0.0
0.4926,Getting a good massage!,0.0,0.385,0.615
0.0,An Extremely Realistic 3D Painting of a Cat,0.0,1.0,0.0
0.4753,Saved this little guy from traffic at 5am.. Reddit meet Figero!,0.0,0.764,0.236
-0.4003,"Walked into the shelter and asked which cat had been there the longest... came home with a deaf, toothless senior lovebug. Reddit, meet Cali!",0.109,0.891,0.0
0.0,When I finally get home from work and sit down,0.0,1.0,0.0
0.0,I’m cat sitting. Cats need tanks. He didn’t even let me finish before claiming it.,0.0,1.0,0.0
-0.0516,"This is Humphrey, our foster boy who failed his sheepdog training because he just wanted to be friends with the sheep.",0.13,0.748,0.122
0.0,Cat practises his moves while waiting his turn,0.0,1.0,0.0
0.3182,"Got quarantined at the vet and had to give Crouton a little pep talk that the other dogs DO wanna be his friend, he’s just too sick to play with them right now.",0.087,0.765,0.148
0.5023,This lil’ girl’s face has gotten more white every year but her smile hasn’t changed.,0.0,0.812,0.188
0.3612,My mom’s cat looks like she’s wearing a fancy sweater.,0.0,0.762,0.238
0.0,"After 4 years of begging, my mom finally let my dad get a puppy!",0.0,1.0,0.0
0.0,She’s keeping him company,0.0,1.0,0.0
0.0,If the snoot fits...,0.0,1.0,0.0
0.4404,Who's a good boy?,0.0,0.408,0.592
-0.4019,My pup injured her eye and now is having to wear goggles when she goes for a run.,0.144,0.856,0.0
0.0,Neighboring husky boi returns an awoo,0.0,1.0,0.0
0.4215,Grandpa saved a rabbit 🐰,0.0,0.417,0.583
0.8731,This cute little bundle of joy enjoying his little bath,0.0,0.413,0.587
0.0,Baby Scooby Doo,0.0,1.0,0.0
0.0,I've looked at him the same way since 1975,0.0,1.0,0.0
0.4215,"Rescued a senior Floofer this year, we call this her “retirement.”",0.0,0.763,0.237
0.2263,My husband is a Fedex driver. He found a lost dog today and picked him up in his truck. He rode with him until he was safely returned to his owner.,0.071,0.831,0.098
0.6124,It's important to enjoy what you do,0.0,0.5,0.5
0.6597,"Last July a stray kitten came into my office, looked at me like ""you are my human"", so I adopted her. Today, this happened. Guess now I'm an owner of another good girl.",0.0,0.843,0.157
0.8412,Winnie is a rescue cat who LOVES to swim! Here's the first time she ever swam.,0.0,0.618,0.382
0.0,Saw my cat sleeping in a familiar pose so I made him into a shirt,0.0,1.0,0.0
0.0,I think someone spilled a bag of ducks near aisle 6,0.0,1.0,0.0
0.3612,Thank you for food,0.0,0.545,0.455
0.0,This little guy has a forever home now,0.0,1.0,0.0
0.0,My grandma turned 101 today!,0.0,1.0,0.0
-0.3612,"Corgi is terrified of going to the vet, so he brings his companion along for comfort",0.195,0.683,0.122
0.0,All tuckered out from digging,0.0,1.0,0.0
0.5574,"Eight years ago, I visited France and went on a tour of castles in the Loire Valley. This dog was hanging out the window staring longingly. Everyone left the tour to give him pets. 10/10 good castle boy.",0.0,0.881,0.119
0.0,I've been a veterinarian for 10 years. This is the first dinosaur I've worked on.,0.0,1.0,0.0
0.6369,Comforts his wife even though he fell as well.,0.0,0.574,0.426
0.0,When you find out you're pregnant,0.0,1.0,0.0
0.3612,How am I supposed to study like this?,0.0,0.706,0.294
0.0,"I️ saw that pitbulls & goldens can hold eggs in their mouths, why not my lab?",0.0,1.0,0.0
0.2732,Something is wrong with my cat and I love him for it,0.19,0.552,0.258
0.6369,They tried their best 🐶,0.0,0.417,0.583
0.0,This is Bradley practicing his first hops at The Kangaroo Sanctuary in Central Australia,0.0,1.0,0.0
0.4215,Cat with the Fireman that saved him,0.0,0.682,0.318
0.9422,All I've ever wanted is a nice photo with someone that I love. Thank you to the kind stranger that said yes to taking this!,0.0,0.531,0.469
-0.624,Lil fox loses his fren and is completely bamboozled.,0.421,0.579,0.0
-0.1779,Weird doggo took big doggo bed,0.254,0.746,0.0
0.8932,This guy got no shows for 3 different adoption days. When we met he climbed right into my lap and I fell in love. Now he's my first dog and lifelong best friend. Meet Winston!,0.051,0.673,0.276
0.4404,Good Boye Ran Into Glass Door Too Many Times,0.0,0.734,0.266
0.7906,Swan gives owner a loving hug,0.0,0.3,0.7
0.0,Putting on the brakes,0.0,1.0,0.0
0.0,I met this cat today who showed me how to pet her,0.0,1.0,0.0
0.6369,I think I found the happiest lamb of all time,0.0,0.625,0.375
-0.1027,My geriatric cat has a hard time cleaning her face. She came up with a plan.,0.097,0.903,0.0
0.5719,How my mother decided to celebrate Hanukkah while her kids are away at college,0.0,0.778,0.222
0.0,for those who say cats aren’t “affectionate “,0.0,1.0,0.0
0.4404,"My good girl Georgie, 12 years later.",0.0,0.674,0.326
0.0,Found this guy in the barn this morning!,0.0,1.0,0.0
0.0,"MY wife and her Pupper 30 years ago, and our daughter and her pupper.",0.0,1.0,0.0
0.3612,Apparently Caracal kittens sound like laser beams.,0.0,0.706,0.294
0.0,This photographer who was approached by a baby deer and a baby wolf,0.0,1.0,0.0
0.8858,A very happy doggo with a beautiful smile,0.0,0.224,0.776
0.6369,"Man reunited with his dog after fires in Paradise, CA",0.0,0.682,0.318
-0.3182,Found this guy in Afghanistan. I brought him home cause he was cool as shit.,0.201,0.67,0.128
0.4767,When she trusts you completely.,0.0,0.563,0.437
0.0,Motherhood transcends species,0.0,1.0,0.0
0.0,Zero f*cks given about personal space,0.0,1.0,0.0
0.128,Are you feeling blue?,0.0,0.667,0.333
0.3612,I feel like I'm being watched,0.0,0.615,0.385
0.0,The Airbnb I stayed at a couple months ago had the sweetest cat,0.0,1.0,0.0
0.5859,"Making its breed world debut in New Zealand, dubbed “The Worlds Cutest Sheep”",0.0,0.759,0.241
-0.1027,Parenting is hard when you have a naughty kid,0.167,0.833,0.0
0.508,smart dog !!,0.0,0.379,0.621
0.0,About 16 months of life experience later,0.0,1.0,0.0
0.0,Puss in,0.0,1.0,0.0
0.0,Duck joins pile of cats,0.0,1.0,0.0
0.631,"This is Maggie, my grandads old girl. She doesn’t get as much attention anymore but she always brings you a leaf. You can’t have the leaf, she just wants you to be proud.",0.0,0.882,0.118
0.0,Walking an 11 year old dog vs a 6 month old dog,0.0,1.0,0.0
0.6249,"Met the girl of my dreams today, returned twice, I'm giving her a forever home.",0.0,0.702,0.298
-0.8074,"Last year, I built a sound-proofed, built-in doghouse under my stairs, so Bucky would have a safe place to hide when he got scared. On the 4th of July, he let me know, in no uncertain terms, that I had wasted my time.",0.254,0.686,0.06
0.0,This is Mashed Potatoes. She was named by my 4 yr. old,0.0,1.0,0.0
0.4215,US nurse discovers colleague doctor was premature baby she cared for 28 years ago.,0.0,0.823,0.177
-0.5267,"My fiancé while giving the cat his pain medication for a sore leg: “You know I don’t think these tablets are doing anything” My cat Ferg, one hour later, staring into the cosmic abyss and wondering if penguins have knees.",0.134,0.81,0.056
0.5859,Chilean police puppies are the cutest thing you will see today,0.0,0.725,0.275
0.0,My cat climbed in my hoodie and fell asleep when I got home from work...,0.0,1.0,0.0
0.9194,"Hey 3 people who are awake at 1am and sort by new, plz enjoy this photo of my cat. She usually doesn’t pose, but I thought she looked cute in this shot. 10/10 best kitty.",0.0,0.69,0.31
0.0,Hereby I declare the science wing officially opened!,0.0,1.0,0.0
0.5204,Are rats welcome here??,0.0,0.472,0.528
0.0,Our wedding's beer burros wanted to be a part of the picture,0.0,1.0,0.0
0.0,I don't remember saying I was lonely...,0.0,1.0,0.0
0.5688,He hadn't seen his mom in months so he surprised her like this,0.0,0.702,0.298
0.4404,"Anything you can do, I can do better Dad 😊❤️",0.0,0.734,0.266
0.0,She fell asleep in my palm as we were cleaning out the kit nest today.,0.0,1.0,0.0
0.5563,The most impressive jump I've ever seen a cat make.,0.0,0.69,0.31
0.8662,My dad has never had a cat but loves mine when he comes over to my house. He found a kitten crying outside a couple days ago who prefers sleeping like this. I hope he keeps it...,0.09,0.63,0.28
0.6369,UPS delivery guy takes time out to love on my cat.,0.0,0.704,0.296
0.0,Perks of having a glass dinner table,0.0,1.0,0.0
